{
  "schema_version": "0.2",
  "source_agent": "claude-code",
  "created_at": "2026-07-02T12:00:00Z",
  "repo_root": ".",
  "git": {
    "branch": "${CURRENT_BRANCH}",
    "base_ref": "main",
    "head_sha": "${CURRENT_HEAD}",
    "dirty": true,
    "status_digest": "${CURRENT_STATUS_DIGEST}",
    "repo_state_digest": "${CURRENT_REPO_STATE_DIGEST}"
  },
  "artifacts": {
    "waybill": "WAYBILL.md",
    "diff": "diff.patch",
    "test_summary": "test-summary.md"
  }
}
