{
  "schema_version": "0.2",
  "source_agent": "codex",
  "created_at": "2026-07-02T15:00:00Z",
  "repo_root": ".",
  "handoff": {
    "kind": "delegation_result",
    "parent_agent": "codex",
    "child_agent": "claude-code"
  },
  "git": {
    "branch": "feature/queue-retry-limit",
    "base_ref": "main",
    "head_sha": "unknown",
    "dirty": true
  },
  "artifacts": {
    "waybill": "WAYBILL.md",
    "diff": "diff.patch",
    "commands": "commands.log",
    "test_summary": "test-summary.md"
  }
}
